{
  "henka_id": "HK-0042",
  "sprint_context": 7,
  "fourM_axis": "Method",
  "category": "no-progress-determination",
  "change_origin": "active",
  "impact_level": "actionable",
  "description": "Agent judged that the current plan-then-execute loop could not advance after three distinct attempts at resolving a circular pattern dependency.",
  "affected_artifacts": [
    "harness/human/patterns/circular-dependency-resolver/PATTERN.md"
  ],
  "response_type": "no-progress",
  "attempts": [
    {
      "approach": "Re-derive dependency graph from first principles using forward search.",
      "reason_did_not_advance": "Same cycle re-emerged at the third hop; cycle is structural, not algorithmic."
    },
    {
      "approach": "Apply standard topological-sort tiebreak from prior pattern.",
      "reason_did_not_advance": "Prior pattern assumes acyclic input; precondition not met."
    },
    {
      "approach": "Decompose into two sub-patterns to break the cycle.",
      "reason_did_not_advance": "Decomposition produced sub-patterns with the same structural circularity."
    }
  ],
  "evidence": [
    {
      "claim": "Three distinct approaches were attempted and recorded in this record's attempts[] array.",
      "evidence_class": "observed",
      "confidence": "high",
      "verification": "cat .council/henka-register.jsonl | grep HK-0042"
    }
  ],
  "status": "responded",
  "detected_at": "2026-05-13T22:00:00Z",
  "detected_by_agent": "architect"
}
